{
  "schema_name": "evidence-bundle",
  "schema_version": "1.0.0",
  "evidence_id": "evidence-bbbbbbbbbbbbbbbbbbbbbbbb",
  "case_id": "case-aaaaaaaaaaaaaaaaaaaaaaaa",
  "target_id": "target-disk-nvme0n1",
  "collector": "effexor-recovery-probe",
  "collector_version": "0.1.0",
  "captured_at": "2026-07-27T12:01:00Z",
  "source_status": "ok",
  "facts_schema": "facts.disk-inventory.v1",
  "facts": {
    "partition_count": 4,
    "has_esp": true
  },
  "artifacts": [
    {
      "artifact_id": "artifact-111111111111111111111111",
      "kind": "json",
      "relative_path": "evidence/disk-inventory.json",
      "sha256": "e3b0c44298fc1c149afbf4c8996fb92427ae41e4649b934ca495991b7852b855",
      "size_bytes": 128,
      "created_at": "2026-07-27T12:01:00Z",
      "media_classification": "case_local"
    }
  ],
  "limitations": []
}
